{"$ref":"http://sports.core.api.espn.com/v2/sports/basketball/leagues/nba/athletes/1966/contracts/2024?lang=en&region=us","birdStatus":0,"baseYearCompensation":{"active":false},"poisonPillProvision":{"active":false},"incomingTradeValue":47607350,"outgoingTradeValue":47607350,"minimumSalaryException":false,"optionType":0,"salary":47607350,"salaryRemaining":0,"yearsRemaining":2,"season":{"$ref":"http://sports.core.api.espn.com/v2/sports/basketball/leagues/nba/seasons/2024?lang=en&region=us"},"team":{"$ref":"http://sports.core.api.espn.com/v2/sports/basketball/leagues/nba/seasons/2024/teams/13?lang=en&region=us"},"tradeKicker":{"active":false,"percentage":0.0,"value":0,"tradeValue":0},"tradeRestriction":true,"unsignedForeignPick":false,"active":true}